{
  "count": 7,
  "lastUpdated": "2025-11-01T07:18:25.277Z",
  "byPlatform": {
    "wine": [
      "diablo"
    ],
    "linux-native": [
      "test-adventure-game",
      "test-gui-game"
    ]
  },
  "byCollection": {},
  "byGenre": {
    "role-playing (rpg)": [
      "baldurs-gate-ii-throne-of-bhaal",
      "diablo"
    ],
    "strategy": [
      "baldurs-gate-ii-throne-of-bhaal",
      "diablo"
    ],
    "shooter": [
      "battlefield-2",
      "call-of-duty",
      "wolfenstein-the-new-order"
    ],
    "adventure": [
      "test-adventure-game",
      "wolfenstein-the-new-order"
    ],
    "interactive fiction": [
      "test-adventure-game"
    ],
    "test": [
      "test-gui-game"
    ],
    "utility": [
      "test-gui-game"
    ]
  },
  "byTag": {
    "role-playing (rpg)": [
      "baldurs-gate-ii-throne-of-bhaal",
      "diablo"
    ],
    "strategy": [
      "baldurs-gate-ii-throne-of-bhaal",
      "diablo"
    ],
    "shooter": [
      "battlefield-2",
      "call-of-duty",
      "wolfenstein-the-new-order"
    ],
    "test": [
      "test-adventure-game"
    ],
    "adventure": [
      "test-adventure-game",
      "wolfenstein-the-new-order"
    ],
    "text-based": [
      "test-adventure-game"
    ]
  },
  "search": {
    "titles": {
      "baldur's": [
        "baldurs-gate-ii-throne-of-bhaal"
      ],
      "gate": [
        "baldurs-gate-ii-throne-of-bhaal"
      ],
      "ii:": [
        "baldurs-gate-ii-throne-of-bhaal"
      ],
      "throne": [
        "baldurs-gate-ii-throne-of-bhaal"
      ],
      "bhaal": [
        "baldurs-gate-ii-throne-of-bhaal"
      ],
      "battlefield": [
        "battlefield-2"
      ],
      "call": [
        "call-of-duty"
      ],
      "duty": [
        "call-of-duty"
      ],
      "diablo": [
        "diablo"
      ],
      "test": [
        "test-adventure-game",
        "test-gui-game"
      ],
      "adventure": [
        "test-adventure-game"
      ],
      "game": [
        "test-adventure-game",
        "test-gui-game"
      ],
      "gui": [
        "test-gui-game"
      ],
      "wolfenstein:": [
        "wolfenstein-the-new-order"
      ],
      "the": [
        "wolfenstein-the-new-order"
      ],
      "new": [
        "wolfenstein-the-new-order"
      ],
      "order": [
        "wolfenstein-the-new-order"
      ]
    },
    "fuzzy": {
      "baldur's": [
        "baldurs-gate-ii-throne-of-bhaal"
      ],
      "gate": [
        "baldurs-gate-ii-throne-of-bhaal"
      ],
      "ii:": [
        "baldurs-gate-ii-throne-of-bhaal"
      ],
      "throne": [
        "baldurs-gate-ii-throne-of-bhaal"
      ],
      "bhaal": [
        "baldurs-gate-ii-throne-of-bhaal"
      ],
      "battlefield": [
        "battlefield-2"
      ],
      "call": [
        "call-of-duty"
      ],
      "duty": [
        "call-of-duty"
      ],
      "diablo": [
        "diablo"
      ],
      "test": [
        "test-adventure-game",
        "test-gui-game"
      ],
      "adventure": [
        "test-adventure-game"
      ],
      "game": [
        "test-adventure-game",
        "test-gui-game"
      ],
      "gui": [
        "test-gui-game"
      ],
      "wolfenstein:": [
        "wolfenstein-the-new-order"
      ],
      "the": [
        "wolfenstein-the-new-order"
      ],
      "new": [
        "wolfenstein-the-new-order"
      ],
      "order": [
        "wolfenstein-the-new-order"
      ]
    }
  },
  "recent": [
    "wolfenstein-the-new-order",
    "call-of-duty",
    "battlefield-2",
    "diablo",
    "baldurs-gate-ii-throne-of-bhaal",
    "test-adventure-game",
    "test-gui-game"
  ],
  "popular": [
    "test-adventure-game"
  ]
}
